{"status":"partial","final_answer":"evidence|hardness_state|screen|n_results","evidence":[{"url":"https://www.waterqualitydata.us/provider/STORET/21COL001_WQX/21COL001_WQX-7182/","locator":"Lines 44–49 and 80–85 identify the requested location and organization."},{"url":"https://www.epa.gov/wqc/national-recommended-water-quality-criteria-aquatic-life-criteria-table","locator":"Lines 47–49 state that the 2016 chronic freshwater cadmium criterion was vacated and direct users to the 2001 update; lines 153–157 describe hardness-dependent equations."},{"url":"https://nepis.epa.gov/Exe/ZyPURL.cgi?Dockey=20003I26.TXT","locator":"Lines 714–754 provide the 2001 chronic hardness slope, dissolved-metal conversion factor, and criterion derivation."}],"limitations":["The task-specific WQP result retrieval was explicitly denied as non-retryable. Under the retrieval policy, it could not be retried or obtained through another representation or tool. Consequently, dissolved-cadmium results, qualifier/limit metadata, exact-activity hardness matches, and defensible group counts could not be verified; no rows were guessed.","External retrieval count: 50 request items.","Default-page case: the WQP organization index exposed more than 20 monitoring-location identities on its ordinary page; it was used only to confirm the requested site and was not exhaustively paginated."]}